{"protocol":"relay.run-state/v1","run_id":"R001-relay-dhr72-real-checkpoint-1-20260905","run_status":"running","group":"running","progress":{"done":0,"total":1},"elapsed_seconds":0,"node_states":[{"node_id":"real-product","status":"running","current_attempt_id":"att~07e801d7fb03","attempt_count":1}],"updated_at":"2026-09-05T07:23:25.382Z","state_signature":"f542a27d887f3555267ab3b707fc453dcfb0bc3425684966741d565e6b6cafc3"}